{
  "schema_version": 1,
  "embodiment": "so100",
  "action_space": {
    "type": "continuous",
    "kind": "position",
    "dim": 6,
    "ranges": [
      [
        -3.14,
        3.14
      ],
      [
        -1.57,
        1.57
      ],
      [
        -3.14,
        3.14
      ],
      [
        -1.57,
        1.57
      ],
      [
        -3.14,
        3.14
      ],
      [
        0.0,
        1.0
      ]
    ],
    "units": [
      "radians",
      "radians",
      "radians",
      "radians",
      "radians",
      "gripper_0_1"
    ]
  },
  "normalization": {
    "mean_action": [
      0.0,
      0.0,
      0.0,
      0.0,
      0.0,
      0.5
    ],
    "std_action": [
      0.4,
      0.4,
      0.4,
      0.4,
      0.4,
      0.25
    ],
    "mean_state": [
      0.0,
      0.0
    ],
    "std_state": [
      0.2,
      0.2
    ]
  },
  "gripper": {
    "component_idx": 5,
    "close_threshold": 0.5,
    "inverted": false
  },
  "cameras": [
    {
      "name": "wrist",
      "resolution": [
        640,
        480
      ],
      "fps": 30.0,
      "color_space": "rgb8"
    }
  ],
  "control": {
    "frequency_hz": 15.0,
    "chunk_size": 30,
    "rtc_execution_horizon": 12
  },
  "constraints": {
    "max_ee_velocity": 0.5,
    "max_gripper_velocity": 1.0,
    "collision_check": true
  }
}
